Année,nom des bénéficiaires,Montant du fonds de concours ou de la subvention (numéraire),Prestations en nature
2016,OPERA NATIONAL DE BORDEAUX,16167670,
2016,ASSOCIATION DES CENTRES D'ANIMATION DE QUARTIERS DE BORDEAUX - ACAQB,8060927.5,"Communication, locaux, équipements sportifs,"
2016,CCAS DE BORDEAUX,7912204,
2016,ECOLE D'ENSEIGNEMENT SUPERIEUR D'ART DE BORDEAUX - ESAB,3120000,
2016,ASSOCIATION PITCHOUN,1735000,Locaux
2016,THEATRE NATIONAL DE BORDEAUX EN AQUITAINE - TNBA,1646816,"Communication, locaux"
2016,ASSOCIATION PETITE ENFANCE ENFANCE ET FAMILLE - APEEF,1578403,"Locaux, matériel pour manifestations"
2016,UNION SAINT-BRUNO ,1537650,"Locaux, équipements sportifs, matériel pour"
2016,SPORTING CHANTECLER BORDEAUX NORD LE LAC ,1128560,"Locaux, équipements sportifs, matériel pour"
2016,AVANT GARDE ET JEANNE D'ARC DE BORDEAUX CAUDERAN - AGJA BORDEAUX CAUDERAN,1089439,"Locaux, équipements sportifs, matériel pour"
2016,UNION SPORTIVE LES CHARTRONS ,896350,"Locaux, équipements sportifs, matériel pour"
2016,LES JEUNES DE SAINT AUGUSTIN - JSA ,892663,"Locaux, équipements sportifs, matériel pour"
2016,UNION SAINT JEAN - MAISON DE QUARTIER ,879983,"Locaux, équipements sportifs, matériel pour"
2016,STADE BORDELAIS - ASPTT ,819458,"Locaux, équipements sportifs, matériel pour"
2016,ARC EN REVE,752250,"Communication, matériel pour manifestations, locaux"
2016,"MAISON DE L'EMPLOI, DE L'INSERTION ECONOMIQUE ET DE L'ENTREPRISE DE BORDEAUX",678000,
2016,"CLUB PYRENEES AQUITAINE, ASSOCIATION SPORTIVE, EDUCATIVE ET CULTURELLE",634600,"Locaux, équipements sportifs, matériel pour"
2016,P'TIT BOUT'CHOU,567000,Matériel pour manifestations
2016,ASSOCIATION BRINS D'EVEIL,532800,
2016,ASSOCIATION DE GESTION ET D'ANIMATION DES CRECHES C.S.F. (AGEAC/CSF),512833.33,
2016,MISSION LOCALE BORDEAUX AVENIR JEUNES,494000,"Locaux, matériel pour manifestations"
2016,GP INTENCITE CENTRE SOCIAL ET CULTUREL DU GRAND PARC,492222,"Locaux, matériel pour manifestations"
2016,INTERLUDE,478850,"Locaux, matériel pour manifestations"
2016,CENTRE SOCIAL ET FAMILIAL BORDEAUX NORD ,461165,"Locaux, équipements sportifs, matériel pour"
2016,AMICALE LAIQUE DAVID JOHNSTON LAGRANGE ALBERT BARRAUD NAUJAC,450195,Equipements sportifs
2016,SASP UNION BORDEAUX BEGLES,450000,Matériel pour manifestations
2016,FOYER FRATERNEL,426565,"Locaux, matériel pour manifestations"
2016,FESTIVAL DES ARTS DE BORDEAUX,402000,"Communication, locaux"
2016,ASSOCIATION DU COMITE DES OEUVRES SOCIALES DES MUNICIPAUX DE BORDEAUX - ACOSMB,380000,Matériel pour manifestations
2016,POLE D'ENSEIGNEMENT SUPERIEUR DE LA MUSIQUE ET DE LA DANSE DE BORDEAUX AQUITAINE - PESMD,357672,Locaux
2016,AUTEUIL PETITE ENFANCE,347000,
2016,LES COQS ROUGES,343924,"Equipements sportifs, matériel pour manifestations"
2016,BORDEAUX GRANDS EVENEMENTS (BGE),339500,"Communication, locaux"
2016,GESTION DU CENTRE DE LOISIRS DE LA POSTE ALEMA,334000,
2016,ASSOCIATION PETITS BOUCHONS,311500,
2016,ASSOCIATION POUR L'INNOVATION EN MATIERE D'INTEGRATION,300000,
2016,BOXERS DE BORDEAUX,283000,
2016,SASP JSA BORDEAUX METROPOLE,280000,Matériel pour manifestations
2016,CLUB ATHLETIQUE MUNICIPAL DE BORDEAUX - CAM ,243834,"Locaux, équipements sportifs, matériel pour"
2016,LES ENFANTS D'OSIRIS,240000,
2016,PARALLELES ATTITUDES DIFFUSION - ROCKSCHOOL,237000,"Locaux, matériel pour manifestations, matériel"
2016,BORDEAUX ETUDIANTS CLUB - BEC ,223734,"Locaux, équipements sportifs, matériel pour"
2016,EVEILLEZ LES BEBES,210000,
2016,LES PARENTS DE CAUDERAN,205000,
2016,LUCILANN,200000,
2016,BORDEAUX GIRONDE INVESTISSEMENT,198775,Matériel pour manifestations
2016,LA MANUFACTURE ATLANTIQUE,198000,"Communication, locaux, matériel pour"
2016,GROUPEMENT D'INTERET PUBLIC BORDEAUX MEDIATION,190000,
2016,ESCALES LITTERAIRES BORDEAUX AQUITAINE,185000,"Communication, locaux, matériel pour manifestations"
2016,ASSOCIATION LA COCCINELLE,180000,
2016,O'PTIMOMES LOISIRS,170592,
2016,ASTROLABE,153407,"Locaux, matériel pour manifestations"
2016,GIRONDINS DE BORDEAUX BASTIDE HANDBALL CLUB ,141174,"Locaux, équipements sportifs, matériel pour"
2016,LES GIRONDINS DE BORDEAUX ,132000,"Locaux, équipements sportifs, matériel pour"
2016,NUAGE BLEU,130000,Locaux
2016,OGEC LYCEE BEL ORME,120000,
2016,LA RONDE DES QUARTIERS DE BORDEAUX,119100,"Communication, locaux, matériel pour manifestations"
2016,VILLA PRIMROSE ,119000,"Communication, équipements sportifs, matériel pour"
2016,EMULATION NAUTIQUE DE BORDEAUX,118603,"Locaux, équipements sportifs, matériel pour"
2016,CAISSE SOCIALE DE DEVELOPPEMENT LOCAL,115000,
2016,COS VILLA PIA - EHPAD LES DAMES DE LA FOI,115000,Matériel pour manifestations
2016,GLOB THEATRE,115000,"Locaux, matériel pour manifestations"
2016,MAISON DES JEUNES ET DE LA CULTURE CENTRE DE LOISIRS DES DEUX VILLES - MJC CL2V,110350,Matériel pour manifestations
2016,ECOLE SUPERIEURE DE THEATRE BORDEAUX AQUITAINE - ESTBA,109834,
2016,UNIS CITE,105000,"Locaux, matériel pour manifestations"
2016,FOOTBALL CLUB DES GIRONDINS DE BORDEAUX - FCGB,100000,Equipements sportifs
2016,UNION BORDEAUX METROPOLE - UBM,83680,"Locaux, équipements sportifs"
2016,AMICALE DES ETABLISSEMENTS SCOLAIRES LAIQUES DE BACALAN - ALB,82238,"Locaux, équipements sportifs, matériel pour"
2016,CAP SCIENCES,81568,
2016,BORDEAUX MERIGNAC VOLLEY,80000,Equipements sportifs
2016,LA HALLE DES DOUVES,80000,Locaux
2016,"SOLIHA, SOLIDAIRES POUR L'HABITAT, GIRONDE",73900,Locaux
2016,SEMER LE DOUTE ,73250,"Communication, locaux, matériel pour"
2016,HALTE 33,66000,
2016,RESEAU PAUL BERT CENTRE SOCIAL ET CULTUREL,64000,
2016,AGENCE D'URBANISME BORDEAUX METROPOLE AQUITAINE (A'URBA),60000,
2016,CHAHUTS,57500,"Communication, locaux, matériel pour manifestations"
2016,LA CAISSE A OUTILS,57005,
2016,LA MEMOIRE DE BORDEAUX METROPOLE,56105,"Locaux, matériel informatique"
2016,MAISON DE L'EUROPE BORDEAUX-AQUITAINE (MEBA),56000,Locaux
2016,ASSOCIATION LAIQUE LE PRADO,55000,
2016,LES PETITS DEBROUILLARDS AQUITAINE,54201,Matériel pour manifestations
2016,FONDATION D'AUTEUIL AQUITAINE,52500,Locaux
2016,THEATRE DU PONT TOURNANT,52250,
2016,REGIE DE QUARTIER HABITER BACALAN,51000,Locaux
2016,ASSOCIATION DE DEFENSE DES MUSIQUES ALTERNATIVES EN AQUITAINE - ADMAA (ALLEZ LES FILLES),50580,"Communication, matériel pour manifestations"
2016,ASSOCIATION UNION BORDEAUX BEGLES,50000,Matériel pour manifestations
2016,LA CITE DU VIN,50000,
2016,LE SERVICE GAGNANT,50000,
2016,MAIRES RESPONSABLES METROPOLES FRANCOPHONES - AIMF,50000,
2016,CENTRE D'INFORMATION JEUNESSE AQUITAINE - CIJA,49000,"Locaux, matériel pour manifestations"
2016,"ECOLE DE CIRQUE DE BORDEAUX, CENTRE CULTUREL DES ARTS DU CIRQUE",46500,Locaux
2016,MAISON DE NOLAN,46000,
2016,ASSOCIATION GIRONDINE D'EDUCATION SPECIALISEE ET DE PREVENTION SOCIALE - AGEP,45400,Locaux
2016,ATELIER GRAPHITE,44200,Locaux
2016,COMPAGNIE DES MARCHES DE L'ETE,41500,"Communication, locaux, matériel pour manifestations"
2016,MUSIQUES DE NUIT - DIFFUSION,40700,"Communication, matériel pour manifestations"
2016,CONGRES ET EXPOSITIONS DE BORDEAUX,40000,"Communication, matériel pour manifestations"
2016,ASSOCIATION PROMOTION INSERTION SPORT EN AQUITAINE - APIS,37754,"Equipements sportifs, matériel pour manifestations"
2016,MIGRATIONS CULTURELLES AQUITAINE - AFRIQUES (MC2A),37500,"Locaux, matériel pour manifestations, matériel"
2016,ASSOCIATION DU LIEN INTERCULTUREL FAMILIAL ET SOCIAL - ALIFS,37000,"Locaux, matériel pour manifestations"
2016,BORDEAUX BASTIDE BASKET,35895,"Equipements sportifs, matériel pour manifestations"
2016,MANA,35500,"Locaux, matériel pour manifestations"
2016,GROUPEMENT D'INTERET PUBLIC DE LA REUSSITE EDUCATIVE DE BORDEAUX,35000,
2016,QUATUORS A BORDEAUX,35000,"Communication, locaux, matériel pour manifestations"
2016,FORUM AVIGNON,33251,
2016,TRANSFERT,32987.75,"Communication, locaux, matériel pour manifestations"
2016,CIE LE SOLEIL BLEU,32500,
2016,PROMO-FEMMES SAINT MICHEL,31500,Locaux
2016,ENSEMBLE PYGMALION,31000,
2016,BANQUE ALIMENTAIRE DE BORDEAUX ET DE LA GIRONDE,30500,"Locaux, matériel pour manifestations"
2016,ANPAA - ASSOCIATION NATIONALE DE PREVENTION EN ALCOOLOGIE ET EN ADDICTOLOGIE,30000,Locaux
2016,BORDEAUX GIRONDE HOCKEY SUR GLACE,30000,
2016,CENTRE D'ACCUEIL D'INFORMATION ET D'ORIENTATION - CAIO,30000,Matériel pour manifestations
2016,DIACONAT DE BORDEAUX,30000,Locaux
2016,RESEAU AQUITAIN DEVELOPPEMENT SOLIDARITE INTERNATIONALE,29985,
2016,LES JARDINS D'AUJOURD'HUI,29750,"Locaux, matériel pour manifestations"
2016,MASCARETS,29000,"Locaux, matériel pour manifestations"
2016,URBAN VIBRATIONS SCHOOL,28500,"Locaux, matériel pour manifestations"
2016,BORDEAUX SPORTS DE GLACE,28000,Locaux
2016,COLLECTIF DE RESSOURCES BORDEAUX-NORD,28000,Matériel pour manifestations
2016,ASSOCIATION SPORTIVE CHARLES MARTIN - USEP,27778,
2016,ASSOCIATION FAMILIALE LAIQUE DE BORDEAUX NORD - AFL,27500,"Locaux, matériel pour manifestations"
2016,ECLATS,27000,Locaux
2016,ORGAN PHANTOM,27000,"Locaux, matériel pour manifestations, matériel"
2016,ASSOCIATION POUR UNE EDUCATION BUISSONNIERE,25062,
2016,INSTITUT FRANCAIS,25000,
2016,TRAFIC,25000,
2016,"IPPO (INFORMATION, PREVENTION, PROXIMITE, ORIENTATION)",24500,Locaux
2016,COMPAGNIE REVOLUTION DANCE,23000,
2016,L'EPICERIE,23000,Locaux
2016,LE SPORTING-CLUB DE LA BASTIDIENNE ,23000,"Locaux, équipements sportifs, matériel pour"
2016,ZEBRA 3,23000,Locaux
2016,LE KIOSQUE CULTURE,22500,Locaux
2016,OUVRE LE CHIEN (DANS L'IMMEDIAT),22500,
2016,ACADEMIE YOUNUS ,22000,"Locaux, équipements sportifs, matériel pour"
2016,ACINQBYS_ESPACE 29 A5BIS,22000,
2016,LA BOITE A JOUER,22000,
2016,RACING CLUB DE BORDEAUX METROPOLE,22000,"Equipements sportifs, matériel pour manifestations"
2016,BORDEAUX ENTREPRENEURS,21600,Locaux
2016,VENUS,21500,
2016,POLE MAGNETIC,21350,"Locaux, matériel pour manifestations"
2016,AQUINUM - ASSOCIATION DES PROFESSIONNELS DU NUMERIQUE EN AQUITAINE,21000,"Locaux, matériel pour manifestations"
2016,BORDEAUX SERVICE SOLIDARITE,21000,
2016,INCUBATEUR AU FEMININ BORDEAUX AQUITAINE,21000,
2016,O SOL DE PORTUGAL,20686,
2016,CENTRE JEAN VIGO EVENEMENTS,20500,"Communication, locaux, matériel pour manifestations"
2016,COMITE D'ETUDE ET D'INFORMATION SUR DROGUE (PREV. ET TRAITEMENT TOXICOMANIES ET AUTRES ADDICTIONS),20500,"Locaux, équipements sportifs, matériel pour"
2016,AIM ACTIONS INTER MEDIATION,20060,
2016,UNION SPORTIVE JEUNES DE SAINT-AUGUSTIN - CLUB PYRENEES-AQUITAINE (US JSA-CPA),19500,Matériel pour manifestations
2016,9-33,19000,"Communication, locaux"
2016,CIRQUE ECLAIR ECOLE CIRQUE D'AQUITAINE,19000,
2016,SURF INSERTION,19000,
2016,LE KFE DES FAMILLES,18800,Matériel pour manifestations
2016,MONOQUINI,17528,
2016,COMPAGNIE PAUL LES OISEAUX,17500,
2016,COMPAGNIE THEATRALE L'OEIL,17000,
2016,N'A QU'UN OEIL,17000,
2016,YAKAFAUCON,17000,"Locaux, matériel pour manifestations"
2016,SOCIETE ARCHEOLOGIQUE DE BORDEAUX,16770,Locaux
2016,LYCEE PROFESSIONNEL JEHAN DUPERIER,16628.76,
2016,COMPAGNONS BATISSEURS AQUITAINE,16000,
2016,FEDERATION DES SOCIETES CARNAVALESQUES DE L'AGGLOMERATION BORDELAISE,16000,Matériel pour manifestations
2016,GROUPE ANAMORPHOSE,16000,
2016,L'ATELIER REMUMENAGE,16000,Locaux
2016,LYCEE VITICOLE-CFPPA CHATEAU DILLON (EPLEFPA),15920.46,
2016,CLUB DES ENTREPRISES DE BORDEAUX,15800,Matériel pour manifestations
2016,ASSOCIATION DE SOUTIEN AUX INVENTIONS LIBRES (ASIL),15500,"Communication, locaux, matériel pour manifestations"
2016,FAMILLES EN GIRONDE - FEDERATION DE LA GIRONDE,15500,Locaux
2016,ASSOCIATION ALCHIMIST,15280,
2016,AMOS,15000,
2016,BRUIT DU FRIGO,15000,Matériel pour manifestations
2016,CARTOONING FOR PEACE,15000,
2016,CONSEIL DEPARTEMENTAL DES ASSOCIATIONS FAMILIALES LAIQUES DE LA GIRONDE - CDAFAL 33,15000,Locaux
2016,ENTREPRISE INTERMEDIAIRE DE PRODUCTION ET DE FORMATION - EIPF,15000,Locaux
2016,FONDS REGIONAL D'ART CONTEMPORAIN - COLLECTION AQUITAINE,15000,Communication
2016,LA FABRIQUE POLA,15000,"Locaux, matériel pour manifestations"
2016,UNION DEPARTEMENTALE DES CADRES DE LA GIRONDE,15000,
2016,CENTRE SOCIAL BAGATELLE DISPENSAIRE DE BAGATELLE,14800,
2016,ENTR-AUTRES,14800,
2016,MAISON DES ADOLESCENTS DE LA GIRONDE,14653.49,"Locaux, matériel pour manifestations"
2016,BORDEAUX ROCK,14500,"Communication, matériel pour manifestations, locaux"
2016,EINSTEIN ON THE BEACH,14000,Locaux
2016,ITINERAIRES DES PHOTOGRAPHES VOYAGEURS,14000,"Communication, locaux"
2016,LE 308,14000,
2016,LES LEOPARDS DE GUYENNE,14000,Equipements sportifs
2016,OPERA PAGAI,14000,
2016,BORDEAUX ATHLETIC CLUB ,13600,"Locaux, équipements sportifs, matériel pour"
2016,ENVOL D'AQUITAINE,13050,"Locaux, équipements sportifs, matériel pour"
2016,LA COMA,13000,
2016,YAWATA ASSOCIATION DES ECHANGES DE PROCEDES ARTISTIQUES,13000,Matériel pour manifestations
2016,INSTITUT D'ETUDES POLITIQUES SCIENCES PO,13000,
2016,AQUITEC,12000,Matériel pour manifestations
2016,INFODROITS,12000,
2016,MAISON DE L'INITIATIVE ET DE L'ENTREPRENEURIAT - MIE,12000,Matériel pour manifestations
2016,TRAVAUX PUBLICS COMPAGNIE,12000,
2016,LE 4 DE BORDEAUX,11950,"Locaux, matériel pour manifestations"
2016,CENTRE CULTUREL ET D'ANIMATION DES JEUNES - YAVNE,11620,
2016,BOXING CLUB BORDELAIS,11500,Equipements sportifs
2016,CENTRE DE PREVENTION ET DE LOISIRS DES JEUNES DE BORDEAUX - CPLJ BORDEAUX,11500,Locaux
2016,LETTRES DU MONDE,11500,"Communication, locaux"
2016,COMPAGNIE PRESENCE MICHEL CAHUZAC,11380,Locaux
2016,COULEURS GARONNE,11176,
2016,AMIS DE L'ORCHESTRE D'HARMONIE DE BORDEAUX,11011,
2016,AIR ROLLER (ATTENTION INERTIE RENOUVELABLE),11000,"Locaux, équipements sportifs"
2016,ASSOCIATION DES COMMERCANTS ET RIVERAINS DU QUARTIER VICTOIRE,11000,Matériel pour manifestations
2016,COLLECTIF OS'O,11000,
2016,CONTRÔLE Z AQUITAINE,10730,
2016,CHAMBRE DES METIERS DE LA GIRONDE,10536.77,
2016,JEUNES SCIENCE BORDEAUX,10083,"Locaux, matériel pour manifestations"
2016,"ACIDD, ASSOCIATION COMMUNICATION ET INFORMATION POUR LE DEVELOPPEMENT DURABLE",10000,Locaux
2016,ASSOCIATION EMMAUS AQUITAINE BORDEAUX FONDATEUR ABBE PIERRE,10000,"Communication, locaux"
2016,CENTRE D'ACTION ET DE PREVENTION CONTRE LA RADICALISATION LIEE A L'ISLAMISME (CAPRI),10000,Locaux
2016,CENTRE RENCONTRES ACTION CULTURELLE BEGLES-CREAC,10000,
2016,DISPARATE,10000,Locaux
2016,IUFN,10000,
2016,L'OUMIGMAG,10000,"Locaux, matériel pour manifestations"
2016,MOUVEMENT ATD QUART MONDE,10000,"Locaux, matériel pour manifestations"
2016,NEW BASKET ATTITUDE,10000,Equipements sportifs
2016,PERMANENCES DE LA LITTERATURE,10000,"Communication, matériel informatique"
2016,PROXIMA CENTAURI,10000,
2016,RESEAU ENTREPRENDRE AQUITAINE,10000,Matériel pour manifestations
2016,RESTAURANTS DU COEUR - RELAIS DU COEUR DE LA GIRONDE,10000,Locaux
2016,SOCIETE PHILOMATHIQUE DE BORDEAUX,10000,Locaux
2016,STADE BASTIDE BORDEAUX BENAUGE - S3B,10000,"Locaux, équipements sportifs"
2016,TERRE ET OCEAN,10000,Locaux
2016,SEW & LAINE,9980,"Locaux, matériel pour manifestations"
2016,ARESVI,9880,
2016,RICOCHET SONORE,9750,"Locaux, matériel pour manifestations"
2016,CULTURES DU COEUR GIRONDE,9600,
2016,RECHERCHES ET SOLIDARITES,9520,
2016,DROP DE BETON,9500,Matériel pour manifestations
2016,LES VIVRES DE L'ART,9500,Matériel pour manifestations
2016,SOCIETE DE SAINT-VINCENT-DE-PAUL - CONSEIL DEPARTEMENTAL DE LA GIRONDE,9500,Locaux
2016,ASSOCIATION DES COMMERCANTS DE CAUDERAN SAINT AMAND,9400,
2016,INSTITUT FRANCAIS DE GEORGIE,9000,
2016,L'AGENCE CREATIVE,9000,Locaux
2016,LA FLECHE DE BORDEAUX ,9000,"Locaux, équipements sportifs, matériel pour"
2016,LES P'TITS GRATTEURS,9000,"Locaux, matériel pour manifestations"
2016,LIGUE INTERNATIONALE CONTRE LE RACISME ET L'ANTISEMITISME - SECTION BORDEAUX & GIRONDE - LICRA,9000,Matériel pour manifestations
2016,ZEKI,9000,
2016,ASSOCIATION DES BROCANTEURS DES CHARTRONS - ABC,8907,Matériel pour manifestations
2016,CLUB SERVICES 33,8800,
2016,LANGUES EN SCÈNE,8640,
2016,AMICALE DES PARENTS D'ELEVES DE L'ECOLE STEHELIN,8605,
2016,BORDEAUX CHANSON,8500,Locaux
2016,"ASSOCIATION DES COMMERCANTS ""BARRIERE DE PESSAC"" BORDEAUX-TALENCE",8400,
2016,HOCKEY GARONNE SPORT,8308,"Locaux, équipements sportifs"
2016,VILLAGE DE LA GROSSE CLOCHE,8300,Matériel pour manifestations
2016,CENTRE DE VOILE DE BORDEAUX LAC,8200,Locaux
2016,BORDEAUX ACCUEILLE,8000,"Locaux, matériel pour manifestations"
2016,COMITE REGIONAL UFOLEP AQUITAINE,8000,
2016,COMPAGNIE DES LUBIES,8000,
2016,CRYPSUM,8000,
2016,DEFI,8000,
2016,L'ENVERS,8000,
2016,LA COMPAGNIE BOUGRELAS,8000,
2016,LE COKTAIL,8000,
2016,THEATRE POPULAIRE JOB,8000,Locaux
2016,UNION DEPARTEMENTALE DES ASSOCIATIONS DE COMBATTANTS ET VICTIMES DE GUERRE DE LA GIRONDE (UDAC),8000,
2016,APSARAS,7932,
2016,DANSE AVEC NOUS,7800,"Communication, locaux, matériel pour manifestations"
2016,MONTS ET MERVEILLES,7800,Locaux
2016,UNION BORDEAUX NORD DES ASSOCIATIONS DE PREVENTION SPECIALISEE,7800,
2016,"ACADEMIE DES SCIENCES, BELLES LETTRES ET ARTS DE BORDEAUX",7600,"Locaux, matériel pour manifestations"
2016,GRAND PORT MARITIME DE BORDEAUX,7600,
2016,AQUITAINE ACTIVE,7500,
2016,LE GIROFARD,7500,Matériel pour manifestations
2016,ASSOCIATION DES COMMERCANTS DE SAINT-AUGUSTIN,7475,"Locaux, matériel pour manifestations"
2016,KAN-KRA TEAM,7370,Equipements sportifs
2016,CALK - COMITE D'ANIMATION LAFONTAINE KLEBER,7300,"Locaux, matériel pour manifestations"
2016,RECUP'R,7100,Matériel pour manifestations
2016,ASSOCIATION RENAISSANCE DES CITES D'EUROPE,7000,Locaux
2016,BORDEAUX OPEN AIR,7000,Matériel pour manifestations
2016,CENTRE D'INFORMATION SUR LES DROITS DES FEMMES ET DES FAMILLES DE LA GIRONDE,7000,
2016,CENTRE REGIONAL D'ECO-ENERGETIQUE D'AQUITAINE - CREAQ,7000,Locaux
2016,IMPACTS AQUITAINE,7000,"Locaux, équipements sportifs"
2016,LA TIERCE,7000,
2016,LOGEA,7000,
2016,FOYER SOCIO-EDUCATIF HORTICOLE,7000,
2016,VIVRE A CAUDERAN,6900,Matériel pour manifestations
2016,UNION DEPARTEMENTALE CONSOMMATION LOGEMENT ET CADRE DE VIE,6800,
2016,ACTIMAGE,6500,
2016,LES CAPRICES DE MARIANNE,6500,
2016,TOMBES DU CIEL,6500,
2016,TUTTI,6500,
2016,VERY CHEAP PRODUCTION,6500,
2016,LE FESTIN,6400,"Locaux, matériel pour manifestations, matériel"
2016,RUE BOUFFARD - ASSOCIATION DES COMMERCANTS,6182,
2016,UNION FRANCAISE SANTE BUCCO-DENTAIRE 33,6100,
2016,AGENCE LOCALE DE L'ENERGIE ET DU CLIMAT (ALEC),6000,Locaux
2016,CLAP SUD OUEST,6000,
2016,COMPAGNIE FOND VERT,6000,
2016,COMPAGNIE LE GRAIN,6000,
2016,J'ADORE CE QUE VOUS FAITES,6000,
2016,LA CHIFFONE RIT,6000,
2016,LA MAISON DES FAMILLES DE BORDEAUX,6000,Locaux
2016,LES FEES PAPILLONS,6000,
2016,MAISON DES FEMMES DE BORDEAUX,6000,"Locaux, matériel pour manifestations"
2016,MANDORA,6000,"Locaux, matériel pour manifestations"
2016,RENAISSANCE DE L'ORGUE A BORDEAUX,6000,"Locaux, matériel pour manifestations"
2016,ASSOCIATION JUDAIQUE ST SEURIN,5900,
2016,CDANSLABOITE,5750,Locaux
2016,ASSOCIATION DES COMMERCANTS DU GRAND PARC,5688,Matériel pour manifestations
2016,AIDES AQUITAINE,5500,
2016,ASSOCIATION CULTURELLE DU MARCHE DES CHARTRONS,5500,Locaux
2016,GRANDIR ENSEMBLE,5500,Equipements sportifs
2016,MERCI GERTRUDE,5500,Matériel pour manifestations
2016,VELO CITE,5394,Matériel pour manifestations
2016,ACCOMPAGNEMENT PSYCHOLOGIQUE ET MEDIATION INTERCULTURELLE - AMI,5000,
2016,ADORA,5000,Locaux
2016,AGORA DES ARTS,5000,Matériel pour manifestations
2016,ASSOCIATION DU PATRIMOINE ISRAELITE D'AQUITAINE,5000,
2016,ASSOCIATION GENERATION DUPATY,5000,Equipements sportifs
2016,ASSOCIATION OXYGENE,5000,"Locaux, matériel pour manifestations"
2016,BOXING CLUB ALAMELE,5000,
2016,CLUB REGIONAL DES ENTREPRISES POUR L'INSERTION DE GIRONDE,5000,
2016,COMPAGNIE HORS SERIE,5000,
2016,CROUS DE BORDEAUX (CENTRE REGIONAL DES OEUVRES UNIVERSITAIRES ET SCOLAIRES),5000,
2016,FEDERATION FRANCAISE D'ATHLETISME,5000,
2016,GUYENNE HANDI-NAGES,5000,Equipements sportifs
2016,LE DESSOUS DES BALANCOIRES,5000,
2016,LE PAIN DE L'AMITIE,5000,
2016,LES DISQUES DU FENNEC,5000,
2016,MAISON DE SANTE PROTESTANTE DE BORDEAUX BAGATELLE,5000,
2016,UNIVERSITE SCIENCES TECHNOLOGIES LILLE 1 - CUEEP,5000,
2016,WIMOOV,5000,
2016,BORDEAUX METROPOLE,5000,
2016,ASSOCIATION DES COMMERCANTS DE LA BARRIERE JUDAIQUE,4880,Matériel pour manifestations
2016,ASPOM JUDO CLUB,4850,
2016,ASSOCIATION DES COMMERCANTS DU CENTRE COMMERCIAL MERIADECK,4700,
2016,"LE LABO, REVELATEUR D'IMAGES",4634,Matériel pour manifestations
2016,ASSOCIATION SPORTIVE DU GOLF DE BORDEAUX LAC,4600,Matériel pour manifestations
2016,ATELIER D'ECO SOLIDAIRE,4550,Matériel pour manifestations
2016,ACCORDERIE BORDEAUX,4500,Locaux
2016,"ALLIANCE DEPARTEMENT 33, JUSQU'AU BOUT ACCOMPAGNER LA VIE...",4500,Locaux
2016,EN ROUTE POUR TRAVAILLER,4500,
2016,IMAGINA MUSIC,4500,Locaux
2016,L'ESPRIT DU PIANO,4500,"Communication, locaux"
2016,LA TRIBALE DEMARCHE,4500,Matériel pour manifestations
2016,LUDOLUDIK,4500,Matériel pour manifestations
2016,MAM LES LUCIOLES,4500,
2016,ASSOCIATION DES COMMERCANTS DE LA RUE DES REMPARTS,4420,
2016,ASSOCIATION DES EXPLOITANTS DU CENTRE COMMERCIAL QUAI DES MARQUES,4400,
2016,SAINT CHRISTOLY GIE,4400,
2016,Ô PLAFOND Entreprises,4300,Matériel pour manifestations
2016,FOOT BALL CLUB BORDEAUX AQUITAINE 33,4250,Equipements sportifs
2016,ASSOCIATION DES ECLAIREUSES ET ECLAIREURS DE FRANCE - REGION AQUITAINE,4072,Matériel pour manifestations
2016,AMICALE DES LOCATAIRES DU PORT DE LA LUNE,4000,
2016,AR'KHAN,4000,
2016,ASSOCIATION DE GESTION DES CENTRES PSYCHANALYTIQUES DE CONSULTATIONS ET DE TRAITEMENT (CPCT),4000,Locaux
2016,ASSOCIATION DE SOLIDARITE AVEC TOUS LES IMMIGRES - BORDEAUX (ASTI BORDEAUX),4000,Locaux
2016,ASSOCIATION DES COMMERÇANTS DU QUARTIER SAINT MICHEL AUTOUR DE LA FLECHE,4000,
2016,ASSOCIATION LES CREANTS,4000,Locaux
2016,ASSOCIATION SPORT EMPLOI,4000,
2016,BORDEAUX-BASTIDE-ESCRIME,4000,"Equipements sportifs, matériel pour manifestations"
2016,BREV’ART ,4000,"Locaux, matériel pour manifestations, matériel"
2016,DATCHA,4000,
2016,DRISSE,4000,
2016,ECOM33,4000,
2016,ELLIPTIQUE DYNAMO,4000,
2016,EQUIPE SAINT VINCENT BORDEAUX CENTRE,4000,
2016,GROUPE 33,4000,
2016,JEUNES MUSULMANS DE LA GIRONDE - JMG,4000,Locaux
2016,L'ATELIER DES BAINS DOUCHES,4000,
2016,LE QUAI AUX LIVRES,4000,
2016,LES AMIS DU GRAND THEATRE - OPERA DE BORDEAUX,4000,"Locaux, matériel pour manifestations"
2016,MA PTITE MAM ECOLO,4000,
2016,MOUVEMENT AUTONOME DE DETOURNEMENT EURISTIQUE (MADE),4000,
2016,MOUVEMENT DU 8 OCTOBRE,4000,
2016,NOS REVES PRODUCTIONS,4000,
2016,OLA,4000,
2016,PLUME PALETTE,4000,
2016,SKIN JACKIN BORDEAUX,4000,
2016,SUR MESURE,4000,
2016,UNISPHERES,4000,
2016,COMMERCANTS DU VILLAGE NANSOUTY,3917,
2016,POMME D'API,3800,
2016,BORDEAUX MARITIME SAUVETAGE & SECOURISME - BM2S,3700,Equipements sportifs
2016,SAINT AUGUSTIN 2015,3700,"Locaux, matériel pour manifestations"
2016,ASSOCIATION BORDEAUX-COMPOSTELLE HOSPITALITE SAINT-JACQUES,3500,Locaux
2016,ASSOCIATION PROMOTION DU GRAND SAINT-MICHEL,3500,
2016,BASTIDE BENAUGE FUTSAL,3500,Equipements sportifs
2016,COMPAGNIE DES LIMBES,3500,
2016,ESPRIT DE QUARTIER,3500,"Locaux, matériel pour manifestations"
2016,LA CHEVRE NOIRE,3500,
2016,SCRIPT,3500,
2016,UNION SPORTIVE VILLENAVAISE CYCLISME,3500,
2016,UNIVERSITE DE BORDEAUX,3500,"Equipements sportifs, matériel pour manifestations"
2016,VOLONTAIRES BORDEAUX 98,3400,
2016,JEUNE CHAMBRE ECONOMIQUE DE BORDEAUX,3300,
2016,ASSOCIATION BORDEAUX GAMES,3220,
2016,ASSOCIATION DES PARALYSES DE FRANCE - APF,3200,Matériel pour manifestations
2016,BORDEAUX GIRONDE QUEBEC,3200,Locaux
2016,LA CABANE A GRATTER,3200,Locaux
2016,AMIS DE L'HOTEL DE LALANDE,3109,
2016,ASSOCIATION DEPARTEMENTALE POUR INFORMATION AU LOGEMENT 33 - ADIL33,3030,
2016,A PETIT PAS,3000,
2016,APPRENTISSA'JEU,3000,
2016,ASSOCIATION DES COMMERCANTS ET ARTISANS LES BERGES DU LAC,3000,Matériel pour manifestations
2016,ASSOCIATION L'ALTERNATIVE-KOUABO,3000,
2016,ASSOCIATION NATIONALE DES JEUNES ENTREPRENEURS D AQUITAINE,3000,
2016,ASSOCIATION NATIONALE LE REFUGE,3000,Locaux
2016,ASSOCIATION PETRONILLE,3000,
2016,ASSOCIATION RAYMONDE ROUSSELLE,3000,
2016,BACALAN TENNIS CLUB - BTC,3000,Equipements sportifs
2016,BADMINTON CLUB BARBEY,3000,"Equipements sportifs, matériel pour manifestations"
2016,BORDEAUX FOOTBALL AMERICAIN - LES LIONS DE BORDEAUX,3000,Equipements sportifs
2016,CATHEDRA,3000,"Locaux, matériel pour manifestations"
2016,CIE L'ESPECE FABULATRICE,3000,
2016,CIMADE - SERVICE OECUMENIQUE D'ENTRAIDE,3000,Locaux
2016,CLUB ALPIN FRANCAIS DE BORDEAUX,3000,"Locaux, matériel pour manifestations"
2016,COMPAGNIE BIVOUAC,3000,
2016,COMPAGNIE ILLICITE FABIO LOPEZ,3000,
2016,COMPAGNIE REG'ART,3000,
2016,D'ASQUES ET D'AILLEURS,3000,
2016,DOCUMENTS D'ARTISTES,3000,
2016,ENSEMBLE VOCAL SAGITTARIUS,3000,
2016,EURROM,3000,Locaux
2016,FENETRE SUR RUE,3000,Matériel pour manifestations
2016,FRANCE BENEVOLAT BORDEAUX GIRONDE,3000,Locaux
2016,HABITAT ET HUMANISME GIRONDE - HH33,3000,Locaux
2016,INCITE - BORDEAUX CUB,3000,
2016,INFO SECTES AQUITAINE,3000,
2016,JE CHERCHE UN JOB,3000,Locaux
2016,JUDO CLUB BACALANAIS,3000,Locaux
2016,L'ART HACHE SCENE,3000,
2016,L'ILE AUX OURSONS,3000,
2016,LA BOITE A SEL,3000,
2016,LA MAISON DU DIABETE ET DE LA NUTRITION,3000,
2016,LA NUIT VENUE,3000,"Locaux, matériel informatique"
2016,LA PETITE PALUCHE,3000,
2016,LES GINKOBILOBIENS,3000,
2016,LES SURPRISES,3000,Locaux
2016,LIGUE DE L'ENSEIGNEMENT,3000,"Locaux, matériel pour manifestations"
2016,MEDECINS DU MONDE,3000,"Locaux, matériel pour manifestations"
2016,POINT DE FUITE,3000,Matériel pour manifestations
2016,SACREE MARMAILLE,3000,
2016,TENNIS CLUB BORDEAUX BASTIDE,3000,Equipements sportifs
2016,TIMELESS BALLET,3000,Matériel informatique
2016,VIVRE AVEC - SOLIDARITES INTERGENERATIONNELLES,3000,Locaux
2016,ASSOCIATION DU PARC D'ACTIVITE DE BORDEAUX NORD,2800,
2016,GENERATIONS TAUZIN,2800,Locaux
2016,LES PETITS FRERES DES PAUVRES DE BORDEAUX,2800,Locaux
2016,AQUITAINE CULTURE,2700,
2016,ASSOCIATION DES COMMERCANTS RUE VOLTAIRE,2670,
2016,COMMERCANTS DE LA RUE DU TEMPLE,2635,
